{
  "project_os_version": "2.0.0-draft",
  "state_version": 1,
  "project": "laundry-os-v2-pilot",
  "status": "IMPLEMENTED_PENDING_VERIFICATION",
  "authority": "PILOT_NON_AUTHORITATIVE",
  "active_stage": "READY_FOR_GOOGLE_LINKING_FRONTEND",
  "active_flow": "authentication-google-account-linking-foundation-v1",
  "blocked_by": [],
  "v1_policy": "READ_ONLY_REFERENCE",
  "git_policy": "NO_COMMIT_OR_PUSH_WITHOUT_EXPLICIT_AUTHORIZATION",
  "updated_at": "2026-07-12T20:30:00+07:00"
}
